Artikel	Nomen	Plural	Bedeutung_KO	Bedeutung_EN	Beispiel	Beispiel_Bedeutung
das	Studium	Studien	대학공부, 연구	study	Studenten erhalten nach vierjährigem Studium ein Diplom.	학생들은 4 년 동안 공부 한 후에 졸업장을받습니다.
das	Dach	Dächer	지붕, 집	roof	Das Dach schützt das Haus vor Regen.	지붕은 비로부터 집을 보호한다.
das	Abitur	Abiture	독일 고등학교 졸업시험	Abitur	Nach dem Abitur besuchte ich die Universität.	졸업 시험후에 나는 대학에 다녔다.
das	Album	Alben	앨범, 게시판	album	Der Sänger hat ein neues Album herausgegeben.	가수는 새로운 앨범을 발표했다.
das	Fremdwort	Fremdwörter	외래어	foreign word	„Chic“, „Chose“, „Computer“, „downloaden“, „Sushi“ sind Fremdwörter im Deutschen.	"Chic", "Chose", "Computer", "Download", "Sushi"는 독일어의 외래어입니다.
das	Gegenteil	Gegenteile	반대	opposite, converse	Das chemische Gegenteil von Base ist Säure.	염기성과 반대의 화학 물질은 산성입니다.
das	Genie	Genies	천재, 괴짜	genius	Er ist vielleicht kein Genie, aber er ist kein Simpel!	그는 아마도 천재는 아니지만 평범하지 않아!
das	Jahrhundert	Jahrhunderte	세기, 백년	century	Das Schloss hat sich im Laufe der Jahrhunderte nur sehr wenig verändert.	성은 수세기 동안 거의 변하지 않았습니다.
das	Gerät	Geräte	도구, 기구	device, unit, equipment	Das Krankenhaus benötigt moderne medizinische Geräte.	병원은 최신 의료장비가 필요합니다.
das	Gerüst	Gerüste	구조물, 토대, 골격	scaffold, framework, structure	Das Gerüst des Betonbaus ist aus Stahl.	콘크리트 구조물의 골격은 강철로 만들어져있다.
die	Schwierigkeit	Schwierigkeiten	어려움, 곤란	difficulty, problem	Es kommen vielleicht Schwierigkeiten auf, aber wir werden sie bewältigen.	몇 가지 어려움이 있겠지만, 우리는 그것들을 극복할 것이다.
die	Natur	Naturen	자연, 본성	nature	Ein Spaziergang in der Natur ist die beste Medizin.	자연에서의 산책은 최고의 약입니다.
die	Sorge	Sorgen	근심, 걱정, 불안	concern, worry, problem	Alles ist gut, es besteht kein Anlass zur Sorge.	모든 것은 괜찮다. 걱정 할 이유가 없다.
die	Spinne	Spinnen	거미	spider	Die Spinne spinnt an ihrem Netz.	거미가 줄을 치고 있다.
die	Tradition	Traditionen	전통, 관습	tradition	Jede Kultur hat ihre eigenen Bräuche und Traditionen.	각 문화마다 고유한 풍습과 전통이 있습니다.
die	Wirtschaftswissenschaft	Wirtschaftswissenschaften	경제학	economic	Sie hat Wirtschaftswissenschaft an der Universität studiert.	그녀는 대학에서 경제학을 전공했습니다.
die	Zivilisation	Zivilisationen	문명, 세련	civilization	Die alten Griechen hielten ihre eigene Zivilisation für den Gipfelpunkt menschlicher Entwicklung.	고대 그리스인들은 자신의 문명이 인간 발달의 절정이라고 생각했습니다.
die	Kindheit	-	어린시절, 유년시절	childhood	Ich habe gute Erinnerungen an meine Kindheit.	나는 어린 시절의 좋은 추억을 가지고있다.
die	Höhle	Höhlen	동굴, 굴	cave, lair	In der Höhle wurden prähistorische Malereien entdeckt.	선사 시대의 동굴에서 그림이 발견되었습니다.
die	Hütte	Hütten	오두막, 움막	hut, cabin, cottage	Er zimmerte seine Hütte ganz alleine.	그는 혼자 오두막을 만들었습니다.
der	Regen	Regen	비	rain	Die Wolken werden Regen bringen.	구름은 비를 불러올 것이다.
der	Moskito	Moskitos	모기	mosquito	Das Spray wehrt Moskitos ab.	스프레이는 모기를 쫓아낸다.
der	Wurm	Würmer	벌레	worm	Der Angler verwendet Würmer als Köder.	낚시꾼은 벌레를 미끼로 사용한다.
der	Stamm	Stämme	줄기, 혈통	stem, root, strain	Die Äste eines Baumes wachsen aus dem Stamm.	나무가지가 줄기에서 자란다.
der	Stein	Steine	돌, 석재	stone, rock	Steine waren über den Strand verstreut.	돌들이 해변을 가로 질러 흩어져있었습니다.
der	Blitz	Blitze	번개, 전광	flash	Die Lampe blitzte einmal und dann war es dunkel.	램프가 한 번 깜박이고 어두워졌습니다.
der	Dschungel	Dschungel	정글, 아열대 우림	jungle	Orang-Utans und Tiger leben im Dschungel.	오랑우탄과 호랑이는 정글에 산다.
der	Donner	Donner	천둥	thunder	Der Lärm des Donners war unerträglich.	천둥소리는 지긋지긋 했다.
der	Himmel	Himmel	하늘	sky	Die Wolken am Himmel werden sich bald auflösen.	하늘의 구름이 곧 사라질 것입니다.
der	Käfer	Käfer	딱정벌레, 비틀	beetle	Der Junge fing im Gras einen Käfer.	그 소년은 풀밭에서 딱정벌레를 잡았다.
das	Paradies	Paradiese	낙원, 천국	paradise	Liebhaber von Schokolade fühlen sich in einer Schokoladenfabrik wie im Paradies.	초콜렛 애호가는 초콜릿 공장이 천국처럼 느껴질 것이다.
das	Dorf	Dörfer	마을, 마을 주민	village	Es gibt ein Dorf jenseits des Flusses.	강 건너편에 마을이 있습니다.
das	Leben	Leben	생활, 삶	life	Es ist wichtig, das Leben zu genießen.	인생을 즐기는 것은 중요합니다.